{
  "report_type": "ModelInstantiationReport",
  "schema_version": "0.1",
  "proposal_id": "P1",
  "runtime": {
    "python_executable": "D:\\software\\envs\\model-instantiation-safe\\python.exe",
    "python_version": "3.11.16",
    "torch_version": "2.14.0+cpu"
  },
  "status": "completed",
  "steps": [
    {
      "step_id": "base_model",
      "status": "created",
      "type": "ResNet"
    },
    {
      "step_id": "parallel_wrapper",
      "status": "created",
      "type": "DataParallel"
    }
  ],
  "checkpoint": {
    "status": "loaded",
    "path": "E:\\城市体检项目\\智能体验证项目\\pytorch_resnet_cifar10\\pretrained_models\\resnet20-12fca82f.th",
    "selector_path": "$.state_dict",
    "load_target": {
      "path": "$",
      "step_id": "parallel_wrapper"
    },
    "strict": true,
    "tensor_count": 97,
    "missing_keys": [],
    "unexpected_keys": [],
    "weights_only": true,
    "map_location": "cpu"
  },
  "model": {
    "target_type": "ResNet",
    "target_module": "resnet",
    "runtime_type": "DataParallel",
    "target_is_torch_module": true,
    "parameter_count": 269722
  },
  "structure_analysis": {
    "report_type": "ModelStructureAnalysisReport",
    "schema_version": "0.1",
    "status": "passed",
    "proposal_id": "P1",
    "source_model_state": {
      "checkpoint_status": "loaded",
      "checkpoint_parameters_loaded": true,
      "checkpoint_fully_matched": true,
      "missing_keys": [],
      "unexpected_keys": []
    },
    "general": {
      "framework": "pytorch",
      "framework_version": "2.14.0+cpu",
      "model_class_name": "ResNet",
      "model_python_module": "resnet",
      "training_mode_at_analysis_start": true,
      "model_family": "CNN",
      "model_family_evidence": {
        "conv_module_count": 19,
        "recurrent_module_count": 0,
        "attention_module_count": 0,
        "linear_module_count": 1,
        "embedding_module_count": 0,
        "transformer_or_attention_name_detected": false,
        "patch_projection_name_detected": false,
        "direct_affine_parameter_pattern": false,
        "classification_is_heuristic": true
      }
    },
    "module_tree": [
      {
        "module_path": "<root>",
        "module_name": "ResNet",
        "module_type": "ResNet",
        "python_module": "resnet",
        "parent_module_path": null,
        "child_module_paths": [
          "conv1",
          "bn1",
          "layer1",
          "layer2",
          "layer3",
          "linear"
        ],
        "depth": 0,
        "is_leaf": false,
        "shared_module_instance": false,
        "shared_module_paths": [],
        "executed_in_forward": null,
        "structural_attributes": {}
      },
      {
        "module_path": "conv1",
        "module_name": "conv1",
        "module_type": "Conv2d",
        "python_module": "torch.nn.modules.conv",
        "parent_module_path": "<root>",
        "child_module_paths": [],
        "depth": 1,
        "is_leaf": true,
        "shared_module_instance": false,
        "shared_module_paths": [],
        "executed_in_forward": null,
        "structural_attributes": {
          "in_channels": 3,
          "out_channels": 16,
          "kernel_size": [
            3,
            3
          ],
          "stride": [
            1,
            1
          ],
          "padding": [
            1,
            1
          ],
          "dilation": [
            1,
            1
          ],
          "groups": 1,
          "bias": false
        }
      },
      {
        "module_path": "bn1",
        "module_name": "bn1",
        "module_type": "BatchNorm2d",
        "python_module": "torch.nn.modules.batchnorm",
        "parent_module_path": "<root>",
        "child_module_paths": [],
        "depth": 1,
        "is_leaf": true,
        "shared_module_instance": false,
        "shared_module_paths": [],
        "executed_in_forward": null,
        "structural_attributes": {
          "num_features": 16,
          "eps": 1e-05,
          "momentum": 0.1,
          "affine": true,
          "track_running_stats": true
        }
      },
      {
        "module_path": "layer1",
        "module_name": "layer1",
        "module_type": "Sequential",
        "python_module": "torch.nn.modules.container",
        "parent_module_path": "<root>",
        "child_module_paths": [
          "layer1.0",
          "layer1.1",
          "layer1.2"
        ],
        "depth": 1,
        "is_leaf": false,
        "shared_module_instance": false,
        "shared_module_paths": [],
        "executed_in_forward": null,
        "structural_attributes": {}
      },
      {
        "module_path": "layer1.0",
        "module_name": "0",
        "module_type": "BasicBlock",
        "python_module": "resnet",
        "parent_module_path": "layer1",
        "child_module_paths": [
          "layer1.0.conv1",
          "layer1.0.bn1",
          "layer1.0.conv2",
          "layer1.0.bn2",
          "layer1.0.shortcut"
        ],
        "depth": 2,
        "is_leaf": false,
        "shared_module_instance": false,
        "shared_module_paths": [],
        "executed_in_forward": null,
        "structural_attributes": {}
      },
      {
        "module_path": "layer1.0.conv1",
        "module_name": "conv1",
        "module_type": "Conv2d",
        "python_module": "torch.nn.modules.conv",
        "parent_module_path": "layer1.0",
        "child_module_paths": [],
        "depth": 3,
        "is_leaf": true,
        "shared_module_instance": false,
        "shared_module_paths": [],
        "executed_in_forward": null,
        "structural_attributes": {
          "in_channels": 16,
          "out_channels": 16,
          "kernel_size": [
            3,
            3
          ],
          "stride": [
            1,
            1
          ],
          "padding": [
            1,
            1
          ],
          "dilation": [
            1,
            1
          ],
          "groups": 1,
          "bias": false
        }
      },
      {
        "module_path": "layer1.0.bn1",
        "module_name": "bn1",
        "module_type": "BatchNorm2d",
        "python_module": "torch.nn.modules.batchnorm",
        "parent_module_path": "layer1.0",
        "child_module_paths": [],
        "depth": 3,
        "is_leaf": true,
        "shared_module_instance": false,
        "shared_module_paths": [],
        "executed_in_forward": null,
        "structural_attributes": {
          "num_features": 16,
          "eps": 1e-05,
          "momentum": 0.1,
          "affine": true,
          "track_running_stats": true
        }
      },
      {
        "module_path": "layer1.0.conv2",
        "module_name": "conv2",
        "module_type": "Conv2d",
        "python_module": "torch.nn.modules.conv",
        "parent_module_path": "layer1.0",
        "child_module_paths": [],
        "depth": 3,
        "is_leaf": true,
        "shared_module_instance": false,
        "shared_module_paths": [],
        "executed_in_forward": null,
        "structural_attributes": {
          "in_channels": 16,
          "out_channels": 16,
          "kernel_size": [
            3,
            3
          ],
          "stride": [
            1,
            1
          ],
          "padding": [
            1,
            1
          ],
          "dilation": [
            1,
            1
          ],
          "groups": 1,
          "bias": false
        }
      },
      {
        "module_path": "layer1.0.bn2",
        "module_name": "bn2",
        "module_type": "BatchNorm2d",
        "python_module": "torch.nn.modules.batchnorm",
        "parent_module_path": "layer1.0",
        "child_module_paths": [],
        "depth": 3,
        "is_leaf": true,
        "shared_module_instance": false,
        "shared_module_paths": [],
        "executed_in_forward": null,
        "structural_attributes": {
          "num_features": 16,
          "eps": 1e-05,
          "momentum": 0.1,
          "affine": true,
          "track_running_stats": true
        }
      },
      {
        "module_path": "layer1.0.shortcut",
        "module_name": "shortcut",
        "module_type": "Sequential",
        "python_module": "torch.nn.modules.container",
        "parent_module_path": "layer1.0",
        "child_module_paths": [],
        "depth": 3,
        "is_leaf": true,
        "shared_module_instance": false,
        "shared_module_paths": [],
        "executed_in_forward": null,
        "structural_attributes": {}
      },
      {
        "module_path": "layer1.1",
        "module_name": "1",
        "module_type": "BasicBlock",
        "python_module": "resnet",
        "parent_module_path": "layer1",
        "child_module_paths": [
          "layer1.1.conv1",
          "layer1.1.bn1",
          "layer1.1.conv2",
          "layer1.1.bn2",
          "layer1.1.shortcut"
        ],
        "depth": 2,
        "is_leaf": false,
        "shared_module_instance": false,
        "shared_module_paths": [],
        "executed_in_forward": null,
        "structural_attributes": {}
      },
      {
        "module_path": "layer1.1.conv1",
        "module_name": "conv1",
        "module_type": "Conv2d",
        "python_module": "torch.nn.modules.conv",
        "parent_module_path": "layer1.1",
        "child_module_paths": [],
        "depth": 3,
        "is_leaf": true,
        "shared_module_instance": false,
        "shared_module_paths": [],
        "executed_in_forward": null,
        "structural_attributes": {
          "in_channels": 16,
          "out_channels": 16,
          "kernel_size": [
            3,
            3
          ],
          "stride": [
            1,
            1
          ],
          "padding": [
            1,
            1
          ],
          "dilation": [
            1,
            1
          ],
          "groups": 1,
          "bias": false
        }
      },
      {
        "module_path": "layer1.1.bn1",
        "module_name": "bn1",
        "module_type": "BatchNorm2d",